{
  "$schema": "https://json-schema.org/draft-07/schema#",
  "$id": "faithro:warp-audit/binary-audit-gate-02-decision-record-real",
  "title": "WARP binary audit GATE 2 human decision record (real, filled)",
  "description": "Registro REAL da autorizacao humana EXCLUSIVA do GATE 2 (materializacao e integridade local). Especifico do GATE 2. Autoriza obter/materializar exatamente o blob fixado, calcular integridade local e remover o arquivo. gate_2_authorized const:true e hashing_authorized const:true (grants do gate); gate_3_authorized e todas as demais flags operacionais const:false; execution_state const:AUTHORIZED_NOT_STARTED. Escopo fixado por const.",
  "type": "object",
  "additionalProperties": false,
  "required": [
    "schema_version", "project", "stage", "record_type", "status", "note",
    "plan_ref", "source_decision_ref", "prior_gate_decision_ref", "gate_0_evidence_ref",
    "integration_ref", "gate", "decider", "role", "authority", "channel", "date",
    "decision", "justification", "authorized_scope", "materialization_scope",
    "precondition", "allowed_methods", "prohibited_actions", "conditions",
    "authorizations", "execution_state", "rollback", "notes"
  ],
  "properties": {
    "schema_version": { "type": "integer", "const": 1 },
    "project": { "type": "string", "const": "WARP" },
    "stage": { "type": "string", "const": "2P-E-C2-A" },
    "record_type": { "type": "string", "const": "binary-audit-gate-02-human-decision-real" },
    "status": { "type": "string", "const": "AUTHORIZED_FOR_SINGLE_GATE" },
    "note": { "type": "string", "minLength": 1 },
    "plan_ref": { "type": "object", "additionalProperties": false, "required": ["path"], "properties": { "path": { "type": "string", "minLength": 1 } } },
    "source_decision_ref": { "type": "object", "additionalProperties": false, "required": ["path"], "properties": { "path": { "type": "string", "minLength": 1 } } },
    "prior_gate_decision_ref": { "type": "object", "additionalProperties": false, "required": ["path"], "properties": { "path": { "type": "string", "minLength": 1 } } },
    "gate_0_evidence_ref": { "type": "object", "additionalProperties": false, "required": ["path"], "properties": { "path": { "type": "string", "minLength": 1 } } },
    "integration_ref": {
      "type": "object",
      "additionalProperties": false,
      "required": ["pr", "squash_commit", "base_branch"],
      "properties": {
        "pr": { "type": "integer", "const": 49 },
        "squash_commit": { "type": "string", "const": "6a078f338bc69307e942ba390b565da4008acc40" },
        "base_branch": { "type": "string", "const": "dev" }
      }
    },
    "gate": {
      "type": "object",
      "additionalProperties": false,
      "required": ["id", "name"],
      "properties": {
        "id": { "type": "integer", "const": 2 },
        "name": { "type": "string", "const": "MATERIALIZATION_AND_LOCAL_INTEGRITY" }
      }
    },
    "decider": { "type": "string", "minLength": 2 },
    "role": { "type": "string", "minLength": 2 },
    "authority": { "type": "string", "minLength": 2 },
    "channel": { "type": "string", "minLength": 2 },
    "date": { "type": "string", "pattern": "^[0-9]{4}-[0-9]{2}-[0-9]{2}$" },
    "decision": { "type": "string", "const": "AUTHORIZE_GATE_2" },
    "justification": { "type": "string", "minLength": 1 },
    "authorized_scope": { "type": "string", "minLength": 1 },
    "materialization_scope": {
      "type": "object",
      "additionalProperties": false,
      "required": [
        "repository_full_name", "repository_visibility", "expected_branch",
        "commit_oid", "tree_oid", "artifact_path", "artifact_blob_oid",
        "artifact_blob_oid_algorithm", "artifact_blob_size", "max_files", "network_scope"
      ],
      "properties": {
        "repository_full_name": { "type": "string", "const": "Neo-Mind/WARP" },
        "repository_visibility": { "type": "string", "const": "PUBLIC" },
        "expected_branch": { "type": "string", "const": "rock_win32" },
        "commit_oid": { "type": "string", "const": "9b1173e9e4e135c68e150704f01186ab5e763acd" },
        "tree_oid": { "type": "string", "const": "1aebae06d5c71a145afc35cc72fcf5c210a08758" },
        "artifact_path": { "type": "string", "const": "win32/WARP.exe" },
        "artifact_blob_oid": { "type": "string", "const": "c853da42d18dfe090b4e941b435d989311faf3dc" },
        "artifact_blob_oid_algorithm": { "type": "string", "const": "GIT_OBJECT_ID" },
        "artifact_blob_size": { "type": "integer", "const": 1137152 },
        "max_files": { "type": "integer", "const": 1 },
        "network_scope": { "type": "string", "const": "GITHUB_OFFICIAL_ONLY" }
      }
    },
    "precondition": {
      "type": "object",
      "additionalProperties": false,
      "required": ["gate_0_completed", "gate_0_outcome", "gate_1_materialization_authorized"],
      "properties": {
        "gate_0_completed": { "type": "boolean", "const": true },
        "gate_0_outcome": { "type": "string", "const": "COMPLETED_PASS" },
        "gate_1_materialization_authorized": { "type": "boolean", "const": true }
      }
    },
    "allowed_methods": { "type": "array", "minItems": 1, "items": { "type": "string", "minLength": 1 } },
    "prohibited_actions": { "type": "array", "minItems": 1, "items": { "type": "string", "minLength": 1 } },
    "conditions": {
      "type": "array",
      "minItems": 20,
      "items": {
        "type": "object",
        "additionalProperties": false,
        "required": ["n", "text"],
        "properties": {
          "n": { "type": "integer", "minimum": 1 },
          "text": { "type": "string", "minLength": 1 }
        }
      }
    },
    "authorizations": {
      "type": "object",
      "additionalProperties": false,
      "required": [
        "human_decision_required", "human_decision_received", "gate_selected",
        "gate_0_completed", "materialization_authorized", "gate_2_authorized",
        "hashing_authorized", "static_inspection_authorized", "local_security_scan_authorized",
        "external_reputation_upload_authorized", "sandbox_creation_authorized",
        "execution_without_client_authorized", "client_copy_provision_authorized",
        "execution_with_client_copy_authorized", "patch_review_authorized",
        "patch_application_authorized", "client_preparation_authorized",
        "vps_access_authorized", "test_account_authorized", "first_login_authorized",
        "distribution_authorized", "gate_3_authorized"
      ],
      "properties": {
        "human_decision_required": { "type": "boolean", "const": true },
        "human_decision_received": { "type": "boolean", "const": true },
        "gate_selected": { "type": "boolean", "const": true },
        "gate_0_completed": { "type": "boolean", "const": true },
        "materialization_authorized": { "type": "boolean", "const": true },
        "gate_2_authorized": { "type": "boolean", "const": true },
        "hashing_authorized": { "type": "boolean", "const": true },
        "static_inspection_authorized": { "type": "boolean", "const": false },
        "local_security_scan_authorized": { "type": "boolean", "const": false },
        "external_reputation_upload_authorized": { "type": "boolean", "const": false },
        "sandbox_creation_authorized": { "type": "boolean", "const": false },
        "execution_without_client_authorized": { "type": "boolean", "const": false },
        "client_copy_provision_authorized": { "type": "boolean", "const": false },
        "execution_with_client_copy_authorized": { "type": "boolean", "const": false },
        "patch_review_authorized": { "type": "boolean", "const": false },
        "patch_application_authorized": { "type": "boolean", "const": false },
        "client_preparation_authorized": { "type": "boolean", "const": false },
        "vps_access_authorized": { "type": "boolean", "const": false },
        "test_account_authorized": { "type": "boolean", "const": false },
        "first_login_authorized": { "type": "boolean", "const": false },
        "distribution_authorized": { "type": "boolean", "const": false },
        "gate_3_authorized": { "type": "boolean", "const": false }
      }
    },
    "execution_state": { "type": "string", "const": "AUTHORIZED_NOT_STARTED" },
    "rollback": { "type": "string", "minLength": 1 },
    "notes": { "type": "string", "minLength": 1 }
  }
}
