{
  "schema_version": 1,
  "project": "WARP",
  "stage": "2P-E-C2-A",
  "record_type": "binary-audit-gate-02-human-decision-real",
  "status": "AUTHORIZED_FOR_SINGLE_GATE",
  "note": "Registro REAL e separado da autorizacao humana do GATE 2 (materializacao e integridade local) do plano da auditoria binaria offline do WARP. Autoriza a obtencao de exatamente o blob Git fixado, em area temporaria isolada fora do repositorio FaithRO, o calculo local de tamanho, Git object ID e SHA-256, a comparacao com os valores esperados e a remocao do arquivo. NAO autoriza executar, inspecionar (PE/strings/imports/assinatura), analisar dinamicamente, criar sandbox, enviar a servico externo, integrar no cliente, distribuir, acessar a VPS nem iniciar o GATE 3. A execucao e registrada na evidencia real separada. STOP_PATH permanece disponivel.",
  "plan_ref": { "path": "client/warp-audit/binary-audit-plan.example.json" },
  "source_decision_ref": { "path": "client/warp-audit/decisions/core-path-decision-record-2026-07-31.json" },
  "prior_gate_decision_ref": { "path": "client/warp-audit/decisions/binary-audit-gate-01-decision-record-2026-08-01.json" },
  "gate_0_evidence_ref": { "path": "client/warp-audit/evidence/binary-audit-gate-00-provenance-evidence-2026-08-01.json" },
  "integration_ref": {
    "pr": 49,
    "squash_commit": "6a078f338bc69307e942ba390b565da4008acc40",
    "base_branch": "dev"
  },
  "gate": { "id": 2, "name": "MATERIALIZATION_AND_LOCAL_INTEGRITY" },
  "decider": "BrunoMNoronha",
  "role": "Responsavel tecnico e mantenedor do projeto FaithRO - Laus Deo",
  "authority": "Responsavel tecnico e mantenedor do projeto FaithRO - Laus Deo",
  "channel": "Claude Code - conversa do projeto FaithRO",
  "date": "2026-08-01",
  "decision": "AUTHORIZE_GATE_2",
  "justification": "O GATE 1 (autorizacao para materializacao) foi concluido e integrado (PR #49), com materialization_authorized=true e gate_2_authorized=false. Autorizo agora exclusivamente o GATE 2 canonico: obter exatamente o objeto Git (blob) fixado pelo OID, restrito ao GitHub oficial, materializa-lo em area temporaria isolada fora do repositorio, confirmar o tamanho, recalcular o Git object ID, calcular o SHA-256 local, comparar com os valores esperados, produzir evidencia auditavel e remover o arquivo. Esta decisao nao autoriza execucao, inspecao estatica/dinamica, sandbox, integracao no cliente, distribuicao, acesso a VPS nem o GATE 3. Correspondencia de hash prova apenas identidade do conteudo obtido, nao seguranca nem aprovacao do binario.",
  "authorized_scope": "Obter e materializar exatamente um objeto: o blob Git fixado no caminho win32/WARP.exe do commit 9b1173e9e4e135c68e150704f01186ab5e763acd (arvore 1aebae06d5c71a145afc35cc72fcf5c210a08758) do repositorio oficial Neo-Mind/WARP, com Git blob OID c853da42d18dfe090b4e941b435d989311faf3dc e tamanho esperado 1137152 bytes. A obtencao fica presa ao objeto imutavel, restrita ao GitHub oficial, sem clone, fetch, pull, archive, release asset, mirror ou fonte de terceiros, sem materializar qualquer outro arquivo, sem executar e sem inspecionar o conteudo alem do calculo de integridade.",
  "materialization_scope": {
    "repository_full_name": "Neo-Mind/WARP",
    "repository_visibility": "PUBLIC",
    "expected_branch": "rock_win32",
    "commit_oid": "9b1173e9e4e135c68e150704f01186ab5e763acd",
    "tree_oid": "1aebae06d5c71a145afc35cc72fcf5c210a08758",
    "artifact_path": "win32/WARP.exe",
    "artifact_blob_oid": "c853da42d18dfe090b4e941b435d989311faf3dc",
    "artifact_blob_oid_algorithm": "GIT_OBJECT_ID",
    "artifact_blob_size": 1137152,
    "max_files": 1,
    "network_scope": "GITHUB_OFFICIAL_ONLY"
  },
  "precondition": {
    "gate_0_completed": true,
    "gate_0_outcome": "COMPLETED_PASS",
    "gate_1_materialization_authorized": true
  },
  "allowed_methods": [
    "reconfirmar a identidade do objeto imutavel por metadados oficiais",
    "obter exatamente o objeto Git (blob) fixado pelo OID, restrito ao GitHub oficial",
    "materializar no maximo um arquivo em diretorio descartavel fora do repositorio FaithRO",
    "medir o tamanho em bytes localmente",
    "recalcular localmente o Git object ID com a representacao Git do objeto blob",
    "calcular localmente o SHA-256 do arquivo",
    "opcionalmente calcular SHA-512 localmente",
    "remover o arquivo materializado apos a coleta das evidencias"
  ],
  "prohibited_actions": [
    "executar o binario",
    "abrir o binario",
    "iniciar por shell, PowerShell ou CMD",
    "Wine",
    "Proton",
    "maquina virtual para executar",
    "sandbox dinamica",
    "inspecao estatica de PE",
    "extracao de strings",
    "analise de imports, exports, recursos ou assinatura",
    "descompilacao",
    "extracao de assets",
    "envio a servico externo",
    "clone",
    "fetch upstream",
    "pull upstream",
    "archive",
    "release asset",
    "mirror",
    "fonte de terceiros",
    "materializar outro arquivo",
    "patch",
    "alteracao do executavel",
    "integracao no cliente",
    "distribuicao",
    "login",
    "VPS",
    "modificar PACKETVER",
    "alteracao do core do rAthena",
    "iniciar o GATE 3"
  ],
  "conditions": [
    { "n": 1, "text": "A autorizacao vale somente para o GATE 2 (materializacao e integridade local)." },
    { "n": 2, "text": "A obtencao fica presa ao objeto Git imutavel (blob OID), nao ao nome da branch." },
    { "n": 3, "text": "A rede fica restrita ao GitHub oficial (GITHUB_OFFICIAL_ONLY)." },
    { "n": 4, "text": "Sao proibidos clone, fetch, pull, archive, release asset, mirror e fonte de terceiros." },
    { "n": 5, "text": "Exatamente um arquivo pode ser materializado; nenhum outro arquivo." },
    { "n": 6, "text": "O arquivo e materializado em area temporaria isolada fora do repositorio FaithRO." },
    { "n": 7, "text": "O executavel nunca pode ser versionado, anexado ao PR, publicado como artifact/release ou distribuido." },
    { "n": 8, "text": "Sao calculados localmente: tamanho, Git object ID e SHA-256." },
    { "n": 9, "text": "O Git object ID usa a representacao Git 'blob <size>\\0<content>' (SHA-1); nao e o SHA-256." },
    { "n": 10, "text": "O SHA-256 e o hash do conteudo; nao e o Git object ID e nao prova seguranca." },
    { "n": 11, "text": "PASS exige exatamente um arquivo, tamanho igual ao esperado e Git blob OID igual ao esperado." },
    { "n": 12, "text": "Divergencia de tamanho ou Git blob OID resulta em COMPLETED_FAIL sem inspecao nem fallback." },
    { "n": 13, "text": "Nao ha fallback para outra fonte em caso de falha." },
    { "n": 14, "text": "Nenhuma execucao do binario e autorizada." },
    { "n": 15, "text": "Nenhuma inspecao estatica de PE (strings, imports, exports, recursos, assinatura) e autorizada." },
    { "n": 16, "text": "Nenhuma analise dinamica e nenhuma sandbox sao autorizadas." },
    { "n": 17, "text": "Nenhum envio a servico externo (VirusTotal, Any.Run, Hybrid Analysis, etc.) e autorizado." },
    { "n": 18, "text": "Nenhuma integracao no cliente, patch, login, distribuicao ou acesso a VPS e autorizado." },
    { "n": 19, "text": "O arquivo materializado deve ser removido apos a coleta das evidencias." },
    { "n": 20, "text": "Correspondencia de hash prova identidade do conteudo, nao seguranca, benignidade, licenca de redistribuicao ou adequacao ao cliente." },
    { "n": 21, "text": "gate_3_authorized permanece false; o GATE 3 exige nova decisao humana." },
    { "n": 22, "text": "STOP_PATH permanece disponivel; o merge deste registro nao autoriza o GATE 3." }
  ],
  "authorizations": {
    "human_decision_required": true,
    "human_decision_received": true,
    "gate_selected": true,
    "gate_0_completed": true,
    "materialization_authorized": true,
    "gate_2_authorized": true,
    "hashing_authorized": true,
    "static_inspection_authorized": false,
    "local_security_scan_authorized": false,
    "external_reputation_upload_authorized": false,
    "sandbox_creation_authorized": false,
    "execution_without_client_authorized": false,
    "client_copy_provision_authorized": false,
    "execution_with_client_copy_authorized": false,
    "patch_review_authorized": false,
    "patch_application_authorized": false,
    "client_preparation_authorized": false,
    "vps_access_authorized": false,
    "test_account_authorized": false,
    "first_login_authorized": false,
    "distribution_authorized": false,
    "gate_3_authorized": false
  },
  "execution_state": "AUTHORIZED_NOT_STARTED",
  "rollback": "Registro documental: reverter o commit desta branch (antes do merge) ou abrir PR de reversao (apos integracao). A reversao Git nao apaga a decisao humana historica, nao apaga hashes ja observados, nao apaga consultas externas ja realizadas, nao autoriza nova materializacao, execucao, inspecao ou distribuicao e nao substitui nova decisao humana.",
  "notes": "GATE 2 autorizado (gate_2_authorized=true, hashing_authorized=true). A execucao real (materializacao, integridade e limpeza) e registrada na evidencia separada binary-audit-gate-02-integrity-evidence-2026-08-01.json. O GATE 3 permanece nao autorizado (gate_3_authorized=false)."
}
